LIGA,#,FECHA,HASTA,COMPETENCIA,PRUEBA,CIUDAD,CATEGORIA
ESGRIMA,1,02/25/2022 12:00:00 AM,02/27/2022 12:00:00 AM,COMPETENCIA NACIONAL,INDIVDUAL,CALI,MAY JUN CAD M15
ESGRIMA,2,04/22/2022 12:00:00 AM,04/24/2022 12:00:00 AM,COPA ELITE NACIONAL,INDIVDUAL,CALI,MAY JUN  CAD M15
ESGRIMA,3,05/28/2022 12:00:00 AM,05/29/2022 12:00:00 AM,COPA NACIONAL,INDIVDUAL,CALI,MAY JUN CAD M15
ESGRIMA,4,08/05/2022 12:00:00 AM,08/07/2022 12:00:00 AM,GRAN CAMPEONATO NACIONAL,INDIVDUAL,CALI,MAY JUN CAD M15
ESGRIMA,5,10/15/2022 12:00:00 AM,10/17/2022 12:00:00 AM,COPA NACIONAL,INDIVDUAL,CALI,MAY JUN CAD  M15
ESGRIMA,6,11/12/2022 12:00:00 AM,11/14/2022 12:00:00 AM,COPA NACIONAL,INDIVDUAL,CALI,JUN CAD M15
ESGRIMA,7,12/09/2022 12:00:00 AM,12/12/2022 12:00:00 AM,COPA NACIONAL,INDIVDUAL,CALI,JUN CAD M15
BOXEO,8,02/10/2022 12:00:00 AM,02/20/2022 12:00:00 AM,CAMPEONATO NACIONAL JUVENIL,17-18,BOGOTA,FUNDAMENTAL
BOXEO,9,03/03/2022 12:00:00 AM,03/13/2022 12:00:00 AM,CAMPEONATO NACIONAL MAYORES,19-40,BOGOTA,FUNDAMENTAL
BOXEO,10,06/02/2022 12:00:00 AM,06/12/2022 12:00:00 AM,CAMPEONATO NACIONAL MAYORES,19-40,VALLEDUPAR,FUNDAMENTAL
BOXEO,11,06/20/2022 12:00:00 AM,06/30/2022 12:00:00 AM,CAMPEONATO NACIONAL INFANTIL Y PREINFANTIL,"10-12,13-14",SANTA MARTA,FUNDAMENTAL
BOXEO,12,06/21/2022 12:00:00 AM,07/01/2022 12:00:00 AM,CAMPEONATO NACIONAL DE CADETES,15-16,CALI,FUNDAMENTAL
BOXEO,13,08/13/2022 12:00:00 AM,08/23/2022 12:00:00 AM,CAMPEONATO NACIONAL JUVENIL,17-18,CALI,FUNDAMENTAL
BOXEO,14,09/16/2022 12:00:00 AM,09/25/2022 12:00:00 AM,CAMPEONATO NACIONAL MAYORES,19-40,CUCUTA,FUNDAMENTAL
BOXEO,15,10/13/2022 12:00:00 AM,10/23/2022 12:00:00 AM,CAMPEONATO NACIONAL JUVENIL,17-18,CALI,FUNDAMENTAL
BOXEO,16,11/10/2022 12:00:00 AM,11/20/2022 12:00:00 AM,CAMPEONATO NACIONAL MAYORES,19-40,CALI,PREPARATORIO
BOXEO,17,11/24/2022 12:00:00 AM,11/27/2022 12:00:00 AM,INVITACIONAL VILLAVICENCIO,19-40,VILLAVICENCIO,PREPARATORIO
BOXEO,18,12/15/2022 12:00:00 AM,12/23/2022 12:00:00 AM,LIGA NACIONAL DE BOXEO (FORMATO WSB),19-40,BARRANQUILLA,PREPARATORIO
NATACION Y POLO ACUATICO,19,07/08/2022 12:00:00 AM,07/10/2022 12:00:00 AM,CAMPEONATO NACIONAL INTERLIGAS,INFANTIL B JUVENIL A,MEDELLIN,NATACION CARRERAS
NATACION Y POLO ACUATICO,20,07/12/2022 12:00:00 AM,07/16/2022 12:00:00 AM,CAMPEONATO NACIONAL INTERLIGAS,JUVENIL B  MAYORES,MEDELLIN,NATACION CARRERAS
NATACION Y POLO ACUATICO,21,12/09/2022 12:00:00 AM,12/12/2022 12:00:00 AM,CAMPEONATO NACIONAL INTERCLUBES,JUVENIL A & INFANTIL B,CALI,NATACION CARRERAS
NATACION Y POLO ACUATICO,22,12/14/2022 12:00:00 AM,12/18/2022 12:00:00 AM,CAMPEONATO NACIONAL INTERCLUBES,JUVENTUD B MAYORES,CALI,NATACION CARRERAS
NATACION Y POLO ACUATICO,23,03/04/2022 12:00:00 AM,03/06/2022 12:00:00 AM,I PARADA NACIONAL INTERCLUBES DE AGUAAS ABIERTAS,JUVENTUD B  MAYORES,GUATAPE,AGUAS ABIERTAS
NATACION Y POLO ACUATICO,24,05/20/2022 12:00:00 AM,05/22/2022 12:00:00 AM,II PARADA NACIONAL INTERCLUBES DE AGUAAS ABIERTAS,JUVENTUD B MAYORES,CHINCHINA,AGUAS ABIERTAS
NATACION Y POLO ACUATICO,25,08/11/2022 12:00:00 AM,08/14/2022 12:00:00 AM,III PARADA NACIONAL INTERCLUBES DE AGUAAS ABIERTAS,JUVENTUD B MAYORES,SAN ANTERO,AGUAS ABIERTAS
NATACION Y POLO ACUATICO,26,11/04/2022 12:00:00 AM,11/06/2022 12:00:00 AM,IV PARADA NACIONAL INTERCLUBES DE AGUAAS ABIERTAS,JUVENTUD B MAYORES,PRADO- TOLIMA,AGUAS ABIERTAS
NATACION Y POLO ACUATICO,27,04/01/2022 12:00:00 AM,04/04/2022 12:00:00 AM,LIGA NACIONAL,JUVENTUD B MAYORES,BOGOTA-CALI MEDELLIN,AGUAS ABIERTAS
NATACION Y POLO ACUATICO,28,08/25/2022 12:00:00 AM,08/28/2022 12:00:00 AM,LIGA NACIONAL,JUVENTUD B MAYORES,BOGOTA-CALI MEDELLIN,AGUAS ABIERTAS
NATACION Y POLO ACUATICO,29,12/01/2022 12:00:00 AM,12/04/2022 12:00:00 AM,LIGA NACIONAL,JUVENTUD B  MAYORES,BOGOTA-CALI MEDELLIN,AGUAS ABIERTAS
NATACION Y POLO ACUATICO,30,06/23/2022 12:00:00 AM,06/26/2022 12:00:00 AM,CAMPEONATO NACIONAL INTERCLUBES,JUVENTUD B MAYORES,MEDELLIN,NATACION POLO ACUATICO
TENIS DE CAMPO,31,05/08/2022 12:00:00 AM,05/15/2022 12:00:00 AM,CAMPEONATO GRADO 2,SUB12 A SUB 18,IBAGUE,TENIS DE CAMPO
TENIS DE CAMPO,32,07/04/2022 12:00:00 AM,07/10/2022 12:00:00 AM,CAMPEONATO NACIONAL INTERLIGAS,SUB12 A SUB 18,PEREIRA,TENIS DE CAMPO
TENIS DE CAMPO,33,07/05/2022 12:00:00 AM,07/11/2022 12:00:00 AM,CAMPEONATO INTERNACIONAL IBAGUE DESTINO DEPORTE,ABIERTO,IBAGUE,TENIS DE CAMPO
TENIS DE CAMPO,34,09/05/2022 12:00:00 AM,09/11/2022 12:00:00 AM,CAMPEONATO GRADO 3,SUB12 A SUB 18,IBAGUE,TENIS DE CAMPO
GOLF,35,09/06/2022 12:00:00 AM,09/12/2022 12:00:00 AM,SIN DEFINIR CALENDARO,SUB12 A SUB 19,IBAGUE,TENIS DE CAMPO
LEVANTAMIENTO DE PESAS,36,09/07/2022 12:00:00 AM,09/12/2022 12:00:00 AM,CAMPEONATO NACIONAL SUB 23,SUB12 A SUB 19,POR DEFINIR,LEVANTAMIENTO DE PESAS
LEVANTAMIENTO DE PESAS,37,09/21/2022 12:00:00 AM,09/25/2022 12:00:00 AM,NACIONAL SUB 20,SUB 20,CARTAGENA,LEVANTAMIENTO DE PESAS
LEVANTAMIENTO DE PESAS,38,10/13/2022 12:00:00 AM,10/16/2022 12:00:00 AM,NACIONAL SUB 13 Y SUB 15,SUB 13 Y SUB 15,POR DEFINIR,LEVANTAMIENTO DE PESAS
LEVANTAMIENTO DE PESAS,39,11/16/2022 12:00:00 AM,11/20/2022 12:00:00 AM,NACIONAL DE MAYORES Y 2DO CLASIFICATORIO  A JUEGOS DEPORTIVOS NACIONALES,MAYORES,CALI,LEVANTAMIENTO DE PESAS
LEVANTAMIENTO DE PESAS,40,11/17/2022 12:00:00 AM,11/21/2022 12:00:00 AM,CAMPEONATO NACIONAL DE BILLAR A TRES BANDAS INDIVIDUAL SUB 20,SUB 20,CALI,BILLAR TRES BANDAS
LEVANTAMIENTO DE PESAS,41,11/18/2022 12:00:00 AM,11/22/2022 12:00:00 AM,CAMPEONATO NACIONAL DE BILLAR A TRES BANDAS INDIVIDUAL FEMENINO,FEMENINO,CALI,BILLAR TRES BANDAS
LEVANTAMIENTO DE PESAS,42,11/19/2022 12:00:00 AM,11/23/2022 12:00:00 AM,CAMPEONATO NACIONAL DE BILLAR A TRES BANDAS INDIVIDUAL MASCULINO,MAYORES,CALI,BILLAR TRES BANDAS
LEVANTAMIENTO DE PESAS,43,11/20/2022 12:00:00 AM,11/24/2022 12:00:00 AM,CAMPEONATO NACIONAL DE BILLAR POOL INDIVIDUAL MASCULINO,MAYORES,SEDE POR DEFINIR,POL BOLA 8/9/10
LEVANTAMIENTO DE PESAS,44,11/21/2022 12:00:00 AM,11/25/2022 12:00:00 AM,CAMPEONATO NACIONAL DE BILLAR POOL INDIVIDUAL FEMENINO,FEMENINO,SEDE POR DEFINIR,POL BOLA 8/9/10
LEVANTAMIENTO DE PESAS,45,11/22/2022 12:00:00 AM,11/26/2022 12:00:00 AM,CAMPEONATO NACIONAL DE BILLAR POOL POR EQUIPOS,MAYORES,SEDE POR DEFINIR,POL BOLA 8/9/10
LEVANTAMIENTO DE PESAS,46,11/23/2022 12:00:00 AM,11/27/2022 12:00:00 AM,GRAN PRIX PANAMERICANO,MAYORES,CUNDINAMARCA,TRES BANDAS
KARATE DO,47,11/24/2022 12:00:00 AM,11/28/2022 12:00:00 AM,NACIONAL INTERLIGAS 1,TODAS,PENDIENTE,KATA Y KUMITE
KARATE DO,48,06/06/2022 12:00:00 AM,11/25/2022 12:00:00 AM,NACIONAL INTERLIGAS 2,TODAS,VILLAVICENCIO,KATA Y KUMITE
KARATE DO,49,10/17/2022 12:00:00 AM,11/26/2022 12:00:00 AM,NACIONAL INTERLIGAS 3,TODAS,CALI VALLE,KATA Y KUMITE
JUDO,50,10/18/2022 12:00:00 AM,11/27/2022 12:00:00 AM,CAMPEONATO NACIONAL,MAYORES,CALI VALLE,JUDO
MOTOCICLISMO,51,10/19/2022 12:00:00 AM,11/28/2022 12:00:00 AM,VALIDA VELOCIDAD EN TIERRA,TODAS,CALI VALLE,MOTOCICLISMO
MOTOCICLISMO,52,10/20/2022 12:00:00 AM,11/29/2022 12:00:00 AM,MOTO VELOCIDAD,TODAS,CALI VALLE,MOTOCICLISMO
MOTOCICLISMO,53,10/21/2022 12:00:00 AM,11/30/2022 12:00:00 AM,MOTO CROSS,TODAS,CALI VALLE,MOTOCICLISMO
FUTBOL,54,10/22/2022 12:00:00 AM,11/30/2022 12:00:00 AM,FASE FINAL SUB 13 MASCULINO Y FEMENINO,SUB 13,Rosario ARGENTINA,FUTBOL
FUTBOL,55,10/23/2022 12:00:00 AM,12/01/2022 12:00:00 AM,FASE FINAL SUB 15 MASCULINO Y FEMENINO,SUB 15,Rosario ARGENTINA,FUTBOL
FUTBOL,56,10/24/2022 12:00:00 AM,12/02/2022 12:00:00 AM,FASE FINAL SUB 17 MASCULINO Y FEMENINO,SUB 17,Rosario ARGENTINA,FUTBOL
LUCHA,57,10/25/2022 12:00:00 AM,12/03/2022 12:00:00 AM,"Campeonato Nacional Cadetes
2022 “clasificatorio a Juegos
Suramericanos de la juventud”",Cadetes,Rosario ARGENTINA,LUCHA
LUCHA,58,10/26/2022 12:00:00 AM,12/04/2022 12:00:00 AM,Juegos Suramericanos de la juventud 2022,Cadetes,Rosario ARGENTINA,LUCHA
LUCHA,59,10/27/2022 12:00:00 AM,12/05/2022 12:00:00 AM,I Copa Colombia 2022,Mayores,Rosario ARGENTINA,LUCHA
LUCHA,60,10/28/2022 12:00:00 AM,12/06/2022 12:00:00 AM,"Campeonato Panamericano de
Mayores 2022",Mayores,Santiago,LUCHA
LUCHA,61,10/29/2022 12:00:00 AM,12/07/2022 12:00:00 AM,II Copa Colombia 2022,Mayores,Santiago,LUCHA
LUCHA,62,10/30/2022 12:00:00 AM,12/08/2022 12:00:00 AM,"Campeonato nacional de mayores 2022, cmapeonato nacional de playa",Mayores,BOYACA,LUCHA
TENIS DE MESA,63,10/31/2022 12:00:00 AM,12/09/2022 12:00:00 AM,Campeonato Nacional de Equipos,TODAS,BOYACA,TENIS DE MESA
TENIS DE MESA,64,11/01/2022 12:00:00 AM,12/10/2022 12:00:00 AM,Campeonato Nacional Individual y Dobles,TODAS,BOYACA,TENIS DE MESA
TENIS DE MESA,65,11/02/2022 12:00:00 AM,12/11/2022 12:00:00 AM,Campeonato Nacional de Mayores,MAYORES,ANTIOQUIA,TENIS DE MESA
TENIS DE MESA,66,11/03/2022 12:00:00 AM,12/12/2022 12:00:00 AM,Campeonato nacional U15 U21,U15-U21,BOGOTA,TENIS DE MESA
TENIS DE MESA,67,11/04/2022 12:00:00 AM,12/13/2022 12:00:00 AM,Campeonato Nacional Top Colombia,TODAS,RISARALDA,TENIS DE MESA
FUTBOL DE SALON,68,11/05/2022 12:00:00 AM,12/14/2022 12:00:00 AM,XXXIII NACIONAL MASCULINO SUB 17,SUB-17,LA PLATA HUILA,FUTBOL DE SALON
FUTBOL DE SALON,69,11/06/2022 12:00:00 AM,12/15/2022 12:00:00 AM,XXI NACIONAL FEMENINO MAYORES,MAYORES,CHAPARRAL TOLIMA,FUTBOL DE SALON
FUTBOL DE SALON,70,11/07/2022 12:00:00 AM,12/16/2022 12:00:00 AM,II NACIONAL MASCULINO SUB 21,SUB-21,GUADALAJARA DE BUGA VALLE DEL CAUCA,FUTBOL DE SALON
FUTBOL DE SALON,71,11/08/2022 12:00:00 AM,12/17/2022 12:00:00 AM,XV NACIONAL FEMENINO SUB 19,SUB-19,PUEBLO BELLO CESAR,FUTBOL DE SALON
TRIATLON,72,11/09/2022 12:00:00 AM,12/18/2022 12:00:00 AM,CHEQUEO NACIONAL DE MARCAS MINIMAS,"MENORES, JUNIOR Y ELITE",BARRANQUILLA,CHEQUEOS MARCAS MINIMAS
TRIATLON,73,11/10/2022 12:00:00 AM,12/19/2022 12:00:00 AM,1ª VALIDA COPA COLOMBIA DE TRIATLON,"INFANTILES,MENORES, JUNIOR, ELITE Y GRUPOS DE EDAD",PUERTO VELERO BARRANQUILLA,"AQUATLON,SPRINT ESTANDAR"
TRIATLON,74,11/11/2022 12:00:00 AM,12/20/2022 12:00:00 AM,CAMPEONATO NACIONAL INTERLIGAS SPRINT Y 4ª VALIDA COPA COLOMBIA DE TRIATLON,"INFANTILES,MENORES, JUNIOR, ELITE Y GRUPOS POR EDAD",CHINCHINA,AQUATLON Y SPRINT
TRIATLON,75,11/12/2022 12:00:00 AM,12/21/2022 12:00:00 AM,CHEQUEO MARCAS MINIMAS,"MENORES,JUNIOR Y ELITE",PALMIRA,CHEQUEO NACIONAL DE MARCAS MINIMAS
TRIATLON,76,11/13/2022 12:00:00 AM,12/22/2022 12:00:00 AM,5ª COPA COLOMBIA DE TRIATLON,"INFANTILES,MENORES, JUNIOR, ELITE Y GRUPOS POR EDAD",PALMIRA,"ACUATLON,SPRINT ESTANDAR Y PARATRIATLON"
TRIATLON,77,11/14/2022 12:00:00 AM,12/23/2022 12:00:00 AM,CAMPEONATO NACIONAL INTERLIGAS ENDURO Y 12ª COPA COLOMBIANA,"INFANTILES,MENORESJUNIOR ELITE Y GRUPOS POR EDAD",CHINCHINA,"ENDURO ACUATLON, SPRINT DISTANCIA MEDIA Y CAMP NAL PARATLIATLON"
TEJO,78,11/15/2022 12:00:00 AM,12/24/2022 12:00:00 AM,CAMPEONATO NACIONAL JUVENIL DE TEJO MASCULINO,JUVENIL MASCULINO,ARMENIA,TEJO
TEJO,79,11/16/2022 12:00:00 AM,12/25/2022 12:00:00 AM,XXVCAMPEONATO NACIONAL SUB 25MASCULINO Y XII CAMPEONATO NACIONAL SUB 25FEMENINO DE TEJO,SUB 25 MASCULINO Y FEMENINO,CUCUTA,TEJO
TEJO,80,11/17/2022 12:00:00 AM,12/26/2022 12:00:00 AM,XIVCAMPEONATO NACIONAL SENIOR MASTER MASCULINO DE TEJO,SENIOR MASTER MASCULINO,CUNDINAMARCA,TEJO
TEJO,81,11/18/2022 12:00:00 AM,12/27/2022 12:00:00 AM,LXII CAMPEONATO NACIONAL DE MAYORES MASCULINO Y XXVII CAMPEONATO NACIONAL DE MAYORES FEMENINO,MAYORES MASCULINO Y FEMENINO,MONTERIA,TEJO
TEJO,82,11/19/2022 12:00:00 AM,12/28/2022 12:00:00 AM,I CLASIFICATORIO MASCULINO A LOS XXII JUEGOS DEPORTIVOIS NACIONALES 2023,MAYORES MASCULINO Y FEMENINO,BOGOTA,TEJO
TEJO,83,11/20/2022 12:00:00 AM,12/29/2022 12:00:00 AM,I CLASIFICATORIO FEMENINI A LOS XXII JUEGOS DEPORTIVOS NACIONALES 2023,MAYORES MASCULINO Y FEMENINO,NEIVA,TEJO
AJEDREZ,84,11/21/2022 12:00:00 AM,12/30/2022 12:00:00 AM,NACIONAL SUB 18,MAYORES MASCULINO Y FEMENINO,ANTIOQUIA,AJEDREZ
AJEDREZ,85,11/22/2022 12:00:00 AM,12/31/2022 12:00:00 AM,ITT TOLIMA DESTINO DEPORTE II,MAYORES MASCULINO Y FEMENINO,TOLIMA,AJEDREZ
AJEDREZ,86,11/23/2022 12:00:00 AM,01/01/2023 12:00:00 AM,NACIONAL DE MAYORES,MAYORES MASCULINO Y FEMENINO,BOYACA,AJEDREZ
AJEDREZ,87,11/24/2022 12:00:00 AM,01/02/2023 12:00:00 AM,NACIONAL ACTIVO BLITZ DE MAYORES,MAYORES MASCULINO Y FEMENINO,RISARALDA,AJEDREZ
AJEDREZ,88,11/25/2022 12:00:00 AM,01/03/2023 12:00:00 AM,ITT DE LAS AMERICAS,MAYORES MASCULINO Y FEMENINO,TOLIMA,AJEDREZ
AJEDREZ,89,11/26/2022 12:00:00 AM,01/04/2023 12:00:00 AM,PRE JUEGOS POR EQUIPOS 2,MAYORES MASCULINO Y FEMENINO,SANTA MARTA,AJEDREZ
BALONCESTO,90,11/27/2022 12:00:00 AM,01/05/2023 12:00:00 AM,PRIMER CLASIFICATORIO JUEGOS NACIONALES,FEMENINA ABIERTA,SANTA MARTA,BALONCESTO
BALONCESTO,91,11/28/2022 12:00:00 AM,01/06/2023 12:00:00 AM,PRIMER CLASIFICATORIO JUEGOS NACIONALES,MASCULINO ABIERTO,SANTA MARTA,BALONCESTO
PARA ATLETISMO,92,11/29/2022 12:00:00 AM,01/07/2023 12:00:00 AM,"CAMPEONATO NACIONAL DE CLUBES Y MUNICIPIOS Y CLASIFICATORIO A JUEGOS PARAPANAMERICANOS JUVENILES, BOGOTA 2022",U14  U17 -U20,IBAGUE,PARA ATLETISMO
PARA ATLETISMO,93,11/30/2022 12:00:00 AM,01/08/2023 12:00:00 AM,1 CLASIFICATORIO A JUEGOS PARANACIONALES EJE CAFETERO 2023 Y ABIERTO INTERNACIONAL DE PARAATLETISMO,U17  U20 Y MAYORES,IBAGUE,PARA ATLETISMO
PARA ATLETISMO,94,12/01/2022 12:00:00 AM,01/09/2023 12:00:00 AM,"2 CLASIFICATORIO A JUEGOS PARANACIONALES EJE
CAFETERO 2023 Y 1° CLASIFICATORIO AL MUNDIAL PARIS 2023","U17, U20 Y MAYORES",CALI,PARA ATLETISMO
DEPORTES PARA SORDOS,95,12/02/2022 12:00:00 AM,01/10/2023 12:00:00 AM,"PRIMER PREJUEGOCLASIFICATORIO A JUEGOS
PARANCIONALES 2022","U17, U20 Y MAYORES",POR DEFINIR IAGUE O CALI,"AJEDREZ,CICLISMO Y FUTBOL SALA"
DEPORTES PARA SORDOS,96,12/03/2022 12:00:00 AM,01/11/2023 12:00:00 AM,"SEGUNDO PREJUEGO CLASIFICATORIO A JUEGOS
PARANCIONALES 2023","U17, U20 Y MAYORES",CALI,"AJEDREZ,CICLISMO Y FUTBOL SALA"
DEPORTES PARA SORDOS,97,12/04/2022 12:00:00 AM,01/12/2023 12:00:00 AM,"JUEGOS SORDOLIMPICOS DE
VERANO CAXIAS BRASIL","U17, U20 Y MAYORES",BRASIL,"AJEDREZ,CICLISMO Y FUTBOL SALA"
TENIS DE CAMPO EN SILLA DE RUEDA,98,12/05/2022 12:00:00 AM,01/13/2023 12:00:00 AM,I  INTERLIGAS DE TENIS DE CAMPO CLASIFICATORIO JUEGOS PARA NACIONALES 2023,TODAS,MEDELLIN,TENIS DE CAMPO EN SILLA DE RUEDAS
TENIS DE CAMPO EN SILLA DE RUEDA,99,12/06/2022 12:00:00 AM,01/14/2023 12:00:00 AM,II  INTERLIGAS DE TENIS DE CAMPO CLASIFICATORIO JUEGOS PARA NACIONALES 2023,TODAS,CUCUTA,TENIS DE CAMPO EN SILLA DE RUEDAS
TENIS DE MESA ADAPTADO,100,12/07/2022 12:00:00 AM,01/15/2023 12:00:00 AM,I Campeonato Pre-JJPPNN 2023,TODAS,CUCUTA,TENIS DE MESA
TENIS DE MESA ADAPTADO,101,12/08/2022 12:00:00 AM,01/16/2023 12:00:00 AM,II Campeonato Pre-JJPPNN 2023,TODAS,RISARALDA,TENIS DE MESA
TENIS DE MESA ADAPTADO,102,12/09/2022 12:00:00 AM,01/17/2023 12:00:00 AM,Campeonato Nacional Hopes Esperanzas Nacionales y Festival U8 -U9,TODAS,TOLIMA,TENIS DE MESA
LIVITOL,103,12/10/2022 12:00:00 AM,01/18/2023 12:00:00 AM,EVENTO INTERCLUBES INVITACIONAL PREPARATORIO,TODAS,ZIPAQUIRA,AJEDREZ Y FUTBOL 5
LIVITOL,104,12/11/2022 12:00:00 AM,01/19/2023 12:00:00 AM,PRIMER EVENTO CLASIFICATORIO A LOS XXI JUEGOS NACIONALES Y VI JUEGOS PARANACIONALES EJE CAFETERON 2023,TODAS,SIBATE CUNDINAMARCA,FUTBOL 5
LIVITOL,105,12/12/2022 12:00:00 AM,01/20/2023 12:00:00 AM,EVENTO INTERCLUBES INVITACIONAL PREPARATORIO,TODAS,POPAYAN,AJEDREZ
LIVITOL,106,12/13/2022 12:00:00 AM,01/21/2023 12:00:00 AM,SEGUNDO EVENTO CLASIFICATORIO A LOS XXI JUEGOS NACIONALES Y VI JUEGOS PARANACIONALES EJE CAFETERON 2023,TODAS,ARMENIA,AJEDREZ Y FUTBOL 5
DISCAPACIDAD INTELECTUAL,107,12/14/2022 12:00:00 AM,01/22/2023 12:00:00 AM,ABIERTO DE ATLETISMO INTELECTUAL CLASIFICATORIO A JUEGOS PARA NACIONALES EJE CAFETERO2023,MAYORES,BOGOTA,ATLETISMO
DISCAPACIDAD INTELECTUAL,108,12/15/2022 12:00:00 AM,01/23/2023 12:00:00 AM,ABIERTO DE NATACION INTELECTUAL CLASIFICATORIO A JUEGOS PARA NACIONALES EJE CAFETERO2023,MAYORES,BOGOTA,NATACION
DISCAPACIDAD INTELECTUAL,109,12/16/2022 12:00:00 AM,01/24/2023 12:00:00 AM,ABIERTO DE BALONCESTO INTELECTUAL CLASIFICATORIO A JUEGOS PARA NACIONALES EJE CAFETERO2023,MAYORES,BOGOTA,BALONCESTO
DISCAPACIDAD INTELECTUAL,110,12/17/2022 12:00:00 AM,01/25/2023 12:00:00 AM,ABIERTO DE FUTBOL SALA INTELECTUAL CLASIFICATORIO A JUEGOS PARA NACIONALES EJE CAFETERO2023,MAYORES,BOGOTA,FUTBOL SALA
PARA NATACION,111,12/18/2022 12:00:00 AM,01/26/2023 12:00:00 AM,POR DEFINIR CALENDARIO,MAYORES,BOGOTA,FUTBOL SALA
PARAPOWERLIFTING,112,12/19/2022 12:00:00 AM,01/27/2023 12:00:00 AM,POR DEFINIR CALENDARIO,MAYORES,BOGOTA,FUTBOL SALA
PARA ESGRIMA,113,12/20/2022 12:00:00 AM,01/28/2023 12:00:00 AM,I  INTERLIGAS DE ESGRIMA CLASIFICATORIO CLASIFICATORIOS JUEGOS PARA NACIONALES 2023,MAYORES,BOGOTA,ESGRIMA
PARA ESGRIMA,114,12/21/2022 12:00:00 AM,01/29/2023 12:00:00 AM,II INTERLIGAS DE ESGRIMA CLASIFICATORIO CLASIFICATORIOS JUEGOS PARA NACIONALES 2023,MAYORES,BOGOTA,ESGRIMA
GIMNASIA,115,12/22/2022 12:00:00 AM,01/30/2023 12:00:00 AM,CAMPEONATO NACIONAL JUVENIL Y ABIERTO,ADULTOS Y JUVENILES,BOGOTA,GIMNASIA RITMICA
GIMNASIA,116,12/23/2022 12:00:00 AM,01/31/2023 12:00:00 AM,"CAMPEONATO NACIONAL NIVELES, GRUPOS DE EDADES y SENIOR",NIV.- G.E. Y ADULTOS,BOGOTA,GIMNASIA TRAMPOLIN
GIMNASIA,117,12/24/2022 12:00:00 AM,02/01/2023 12:00:00 AM,CAMPEONATO NACIONAL JUVENIL Y ABIERTO,ADULTOS Y JUVENILES,MEDELLIN,GIMNASIA ARTISTICA
GIMNASIA,118,12/25/2022 12:00:00 AM,02/02/2023 12:00:00 AM,CAMPEONATO NACIONAL DE NIVELES DE FEDERADO,NIVELES GR,CALI VALLE,GIMNASIA RITMICA
GIMNASIA,119,12/26/2022 12:00:00 AM,02/03/2023 12:00:00 AM,CAMPEONATO NACIONAL DE GIMNASIA AEROBICA,ADU-JUV -G.E,ZIPAQUIRA,GIMNASIA AEROBICA
GIMNASIA,120,12/27/2022 12:00:00 AM,02/04/2023 12:00:00 AM,CAMPEONATO NACIONAL DE NIVELES DE FEDERADO,NIVELES GAF,BUCARAMANGA,GIMNASIA ARTISTICA
GIMNASIA,121,12/28/2022 12:00:00 AM,02/05/2023 12:00:00 AM,CAMPEONATO NACIONAL DE NIVELES DE FEDERADO,NIVELES GAF,CHIA CUNDINAMARCA,GIMNASIA ARTISTICA
GIMNASIA,122,12/29/2022 12:00:00 AM,02/06/2023 12:00:00 AM,CAMPEONATO NACIONAL DE NIVELES DE FEDERADO,NIVELES GR,ARMENIA,GIMNASIA RITMICA
GIMNASIA,123,12/30/2022 12:00:00 AM,02/07/2023 12:00:00 AM,CAMPEONATO NACIONAL DE NIVELES DE AVALADO,NIVELES GAF,CARTAGENA,GIMNASIA ARTISTICA
HAPKIDO,124,12/31/2022 12:00:00 AM,02/08/2023 12:00:00 AM,1er Campeonato Nacional Clasificatorio a Juegos Nacionales 2023,ABIERTO,LA UNION VALLE,HAPKIDO
HAPKIDO,125,01/01/2023 12:00:00 AM,02/09/2023 12:00:00 AM,CAMPEONATO NACIONAL INTERLIGAS - Junior Juvenil Mayores,ABIERTO,ARMENIA,HAPKIDO
HAPKIDO,126,01/02/2023 12:00:00 AM,02/10/2023 12:00:00 AM,"do Campeonato Nacional 
Clasificatorio a Juegos 
Nacionales 2023",ABIERTO,DOS QUEBRADAS,HAPKIDO
VOLEIBOL SALA,127,01/03/2023 12:00:00 AM,02/11/2023 12:00:00 AM,CAMPEONATO NACIONAL JUVENIL,JUVENIL FEMENINO,DOS QUEBRADAS,VOLEIBOL SALA
VOLEIBOL SALA,128,01/04/2023 12:00:00 AM,02/12/2023 12:00:00 AM,CAMPEONATO NACIONAL JUVENIL,JUVENIL MASCULINO,DOS QUEBRADAS,VOLEIBOL SALA
VOLEIBOL SALA,129,01/05/2023 12:00:00 AM,02/13/2023 12:00:00 AM,CLASIFICATORIO A JUEGOS NACIONALES,SUB 23 ESPECIAL FEMENINO,DOS QUEBRADAS,VOLEIBOL SALA
VOLEIBOL SALA,130,01/06/2023 12:00:00 AM,02/14/2023 12:00:00 AM,CLASIFICATORIO A JUEGOS NACIONALES,SUB 23 ESPECIAL MASCULINO,DOS QUEBRADAS,VOLEIBOL SALA
VOLEIBOL PLAYA,131,01/07/2023 12:00:00 AM,02/15/2023 12:00:00 AM,PARADA U 17MASCULINO Y FEMENINO,U17,DOS QUEBRADAS,VOLAIBOL PLAYA
VOLEIBOL PLAYA,132,01/08/2023 12:00:00 AM,02/16/2023 12:00:00 AM,PARADA U 19MASCULINO Y FEMENINO,U19,DOS QUEBRADAS,VOLAIBOL PLAYA
VOLEIBOL PLAYA,133,01/09/2023 12:00:00 AM,02/17/2023 12:00:00 AM,I PARADA CIRCUITO,ABIERTA,DOS QUEBRADAS,VOLAIBOL PLAYA
VOLEIBOL PLAYA,134,01/10/2023 12:00:00 AM,02/18/2023 12:00:00 AM,II PARADA CIRCUITO,ABIERTA,DOS QUEBRADAS,VOLAIBOL PLAYA
VOLEIBOL PLAYA,135,01/11/2023 12:00:00 AM,02/19/2023 12:00:00 AM,III PARADA CIRCUITO,ABIERTA,DOS QUEBRADAS,VOLAIBOL PLAYA
VOLEIBOL PLAYA,136,01/12/2023 12:00:00 AM,02/20/2023 12:00:00 AM,IV PARADA CIRCUITO,ABIERTA,DOS QUEBRADAS,VOLAIBOL PLAYA
VOLEIBOL PLAYA,137,01/13/2023 12:00:00 AM,02/21/2023 12:00:00 AM,CAMPEONATO NACIONAL SUB 21,SUB 21,DOS QUEBRADAS,VOLAIBOL PLAYA
ACTIVIDADES SUB ACUATICAS,138,01/14/2023 12:00:00 AM,02/22/2023 12:00:00 AM,CAMPEONATO NACIONAL INTERCLUBES,JUV T MAYORES,BARRANQUILLA SANTA MARTA,ACTIVIDADES SUB ACUATICAS-PISCINA
ACTIVIDADES SUB ACUATICAS,139,01/15/2023 12:00:00 AM,02/23/2023 12:00:00 AM,CAMPEONATO NACIONAL INTERCLUBES,ABIERTO,CALI,ACTIVIDADES SUB ACUATICAS PISCINA
ACTIVIDADES SUB ACUATICAS,140,01/16/2023 12:00:00 AM,02/24/2023 12:00:00 AM,CAMPEONATO NACIONAL INTERLIGAS,JUV T MAYORES,BOGOTA,ACTIVIDADES SUB ACUATICAS PISCINA
ACTIVIDADES SUB ACUATICAS,141,01/17/2023 12:00:00 AM,02/25/2023 12:00:00 AM,CAMPEONATO NACIONAL INTERCLUBES,JUV MAY MASTER,CHINCHINA,AGUAS ABIERTAS
ULTIMATE,142,01/18/2023 12:00:00 AM,02/26/2023 12:00:00 AM,Nacional de Ligas Mayores FECODV,"Open
Femenino
Mixto",CHINCHINA,ULTIMATE
ULTIMATE,143,01/19/2023 12:00:00 AM,02/27/2023 12:00:00 AM,Nacional de Ligas Playa Mayores FECODV,"Open
Femenino
Mixto",CHINCHINA,ULTIMATE PLAYA
FUTBOL SALA,144,01/20/2023 12:00:00 AM,02/28/2023 12:00:00 AM,I CLASIFICATORIO JUEGOS NACIONALES FEMENINOS,SUB 20,CHINCHINA,FUTBOL SALA
FUTBOL SALA,145,01/21/2023 12:00:00 AM,03/01/2023 12:00:00 AM,I CLASIFICATORIO JUEGOS NACIONALES MASCULINO,SUB 20,CHINCHINA,FUTBOL SALA
FUTBOL SALA,146,01/22/2023 12:00:00 AM,03/02/2023 12:00:00 AM,INTERLIGAS MASCULINO,SUB 20,Ibagué Tolima,FUTBOL SALA
FUTBOL SALA,147,01/23/2023 12:00:00 AM,03/03/2023 12:00:00 AM,INTERLIGAS FEMENINO,SUB 20,Ibagué Tolima,FUTBOL SALA
FUTBOL PLAYA,148,01/24/2023 12:00:00 AM,03/04/2023 12:00:00 AM,PRE COPA LIBERTADORES,ABIERTA,Ibagué Tolima,FUTBOL PLAYA
,149,01/25/2023 12:00:00 AM,03/05/2023 12:00:00 AM,NACIONAL INTERLIGAS,ABIERTA,Ibagué Tolima,FUTBOL PLAYA
WUSHU,150,01/26/2023 12:00:00 AM,03/06/2023 12:00:00 AM,XXXVI Torneo Nacional Federativo de Wushu,"Infantil, Junior, Juvenil, Mayores, Sénior",Ibagué Tolima,WUSHU
SAVATE,151,01/27/2023 12:00:00 AM,03/07/2023 12:00:00 AM,CAMPEONATO PANAMERICANO Y ABIERTO INTERNACIONAL DE SAVATE,ABIERTO,BOGOTA,SAVATE
SOFBOL,152,01/28/2023 12:00:00 AM,03/08/2023 12:00:00 AM,CAMPEONATO NACIONAL,SIN DEFINIR,BOGOTA,SOFBOL
ATLETISMO,153,01/29/2023 12:00:00 AM,03/09/2023 12:00:00 AM,CAPEONATO NACIONAL DE CLUBES Y MUNICIPIOS,U16 ULTIMO AÑO U18 U20,CALI,ATLETISMO
ATLETISMO,154,01/30/2023 12:00:00 AM,03/10/2023 12:00:00 AM,CAMPEONATO NACIONAL DE CLUBES Y MUNICIPIOS,MAYORES,BOGOTA,ATLETISMO
ATLETISMO,155,01/31/2023 12:00:00 AM,03/11/2023 12:00:00 AM,CAMPEONATO NACIONAL DE SALTOS Y PRUEBAS COMBINADAS,U18 U20 Y MAYORES,IBAGUE,ATLETISMO
ATLETISMO,156,02/01/2023 12:00:00 AM,03/12/2023 12:00:00 AM,CAMPEONATO NACIONAL U20,U20,VALLEDUPAR,ATLETISMO
ATLETISMO,157,02/02/2023 12:00:00 AM,03/13/2023 12:00:00 AM,CAMPEONATO NACIONAL MAYORES,MAYORES,CALI,ATLETISMO
ATLETISMO,158,02/03/2023 12:00:00 AM,03/14/2023 12:00:00 AM,CAMPEONATO NACIONAL U18,U18,BARRANQUILLA,ATLETISMO
ATLETISMO,159,02/04/2023 12:00:00 AM,03/15/2023 12:00:00 AM,CAMPEONATO NACIONA U23,U23,SIN DEFINIR,ATLETISMO
ATLETISMO,160,02/05/2023 12:00:00 AM,03/16/2023 12:00:00 AM,CAMPEONATO NACIONAL U14 U16,U14 U16,MONTERIA,ATLETISMO
ATLETISMO,161,02/06/2023 12:00:00 AM,03/17/2023 12:00:00 AM,CAMPEONATO NACIONAL DE CROSS COUNTRY,U18 U20 Y MAYORES,CALI,ATLETISMO
PATINAJE,162,02/07/2023 12:00:00 AM,03/18/2023 12:00:00 AM,QUINTA VALIDA NAC INTER CLUBES MAYORES,MAYORES,CALI,PATINAJE
PATINAJE,163,02/08/2023 12:00:00 AM,03/19/2023 12:00:00 AM,VALIDA NACIONAL INTERCUBLES,MAYORES,CALI,PATINAJE
PATINAJE,164,02/09/2023 12:00:00 AM,03/20/2023 12:00:00 AM,CAMP NACIONAL INTERLIGAS CLASIFICATORIOS JUEGOS NACIONALES 2023,MAYORES,CALI,PATINAJE
PATINAJE,165,02/10/2023 12:00:00 AM,03/21/2023 12:00:00 AM,CAMP NACIONAL INTERCLUBES MAYORES CLASIFICATORIO JUEGOS NACIONALES 2023,MAYORES,CALI,PATINAJE
PATINAJE ARTISTICO,166,02/11/2023 12:00:00 AM,03/22/2023 12:00:00 AM,PRIMER INTERCLUBES CLASIFICATORIO JUEGOS NACIONALES 2023,MAYORES Y JUNIOR,CALI,PATINAJE ARTISTICO
PATINAJE ARTISTICO,167,02/12/2023 12:00:00 AM,03/23/2023 12:00:00 AM,CAMP NACIONAL INTERLIGA CLASIFICATORIO JUEGOS NACIONALES 2023,MAYORES Y CUARTETOS,CALI,PATINAJE ARTISTICO
PATINAJE ARTISTICO,168,02/13/2023 12:00:00 AM,03/24/2023 12:00:00 AM,ENCUENTRO NAC DE ESCUELAS,NOVATOS E INICIACION,CALI,PATINAJE ARTISTICO
CICLISMO,169,02/14/2023 12:00:00 AM,03/25/2023 12:00:00 AM,CAMPEONATO NACIONAL DE RUTA,ELITE SUB 23 Y DAMAS,PEREIRA,CICLIMSO
CICLISMO,170,02/15/2023 12:00:00 AM,03/26/2023 12:00:00 AM,VUELTA AL TOLIMA,ELITE SUB 23 JUVENIL Y DAMAS,TOLIMA,CICLIMSO
CICLISMO,171,02/16/2023 12:00:00 AM,03/27/2023 12:00:00 AM,VUELTA DE LA JUVENTUD,JUVENIL,POR DEFINIR,CICLIMSO
CICLISMO,172,02/17/2023 12:00:00 AM,03/28/2023 12:00:00 AM,VUELTA AL SUR,ELITE Y DAMAS,"TOLIMA, HUILA CUNDINAMARCA",CICLIMSO
CICLISMO,173,02/18/2023 12:00:00 AM,03/29/2023 12:00:00 AM,VUELTA A COLOMBIA,ELITE,COLOMBIA,CICLIMSO
CICLISMO,174,02/19/2023 12:00:00 AM,03/30/2023 12:00:00 AM,CLASICO RCN,ELITE,COLOMBIA,CICLIMSO
CICLISMO,175,02/20/2023 12:00:00 AM,03/31/2023 12:00:00 AM,CLASICO RCN,JUVENIL Y DAMAS ELITE,COLOMBIA,CICLIMSO
CICLISMO,176,02/21/2023 12:00:00 AM,04/01/2023 12:00:00 AM,CLASICO RCN,PRE JUVENIL,COLOMBIA,CICLIMSO
BMX,177,02/22/2023 12:00:00 AM,04/02/2023 12:00:00 AM,CLASICO RCN,TODAS,COLOMBIA,BMX
BMX,178,02/23/2023 12:00:00 AM,04/03/2023 12:00:00 AM,CLASICO RCN,TODAS,COLOMBIA,BMX
BMX,179,02/24/2023 12:00:00 AM,04/04/2023 12:00:00 AM,CLASICO RCN,TODAS,COLOMBIA,BMX
BMX,180,02/25/2023 12:00:00 AM,04/05/2023 12:00:00 AM,CLASICO RCN,TODAS,COLOMBIA,BMX
BMX,181,02/26/2023 12:00:00 AM,04/06/2023 12:00:00 AM,CLASICO RCN,TODAS,COLOMBIA,BMX
MTB,182,02/27/2023 12:00:00 AM,04/07/2023 12:00:00 AM,CLASICO RCN,TODAS,COLOMBIA,MTB
MTB,183,02/28/2023 12:00:00 AM,04/08/2023 12:00:00 AM,CLASICO RCN,TODAS,COLOMBIA,MTB
MTB,184,03/01/2023 12:00:00 AM,04/09/2023 12:00:00 AM,CLASICO RCN,TODAS,COLOMBIA,MTB
MTB,185,03/02/2023 12:00:00 AM,04/10/2023 12:00:00 AM,CLASICO RCN,TODAS,COLOMBIA,MTB
